_id,category,isTwitter,text,timeCreated
6081e46b2ca45504c455a4aa,,false,"I'm hoping to get advice. My friend keeps putting down the vaccines. I haven't gotten mine yet (but until I do, I stay home, have groceries delivered, and don't really see anyone because I want to be safe until I'm vaccinated). She's constantly sending me messages saying incredibly disparaging things about the vaccine. I understand we're entitled to our opinions, but it makes me uncomfortable because I don't push my views on others. 

I have a child, whereas she doesn't. I've tried to explain that I need to protect my child as best I can by doing my part in staying safe. She carries on by saying the vaccine is Big Pharma controlling us (which aggravates me because my husband works for a pharmaceutical company), the vaccine has a microchip in it (meanwhile she carries a cell phone with GPS) and that the government is trying to harm us with the vaccine...because........it's a gut feeling of hers. Sigh.

What do I say? Sell crazy some place else?

I'm running out of steam with her. It's to the point where we argue because I have to tell her over and over that opinions are like assholes---we all have them. Alas, every day or so it's another bizarre text message about mind control. She wants to come visit us and I said no. I'm just tired of the same conversation. 

My parents have similar view points (not about mind control, just that they feel there's not enough evidence to support the safety of these vaccines so they won't get them). Meanwhile, they see neighbors and friends and it makes me uneasy because they don't socially distance. But it's their choice, so I can't do or say anything. It's also depressing me because they haven't seen us since October and only a handful of times outdoors before that, and they're missing out on their grandson during his toddler years when everything is new and exciting for him. It really bums me out. But I'm doing what I feel is right, and I'm keeping my son away from them because they don't take COVID seriously in my opinion. To each their own, but I have a responsibility to my family and until we're vaccinated, I have to keep my trio safe. My son and husband are my priority. 

I'm also unsure about some family gatherings on the horizon. Fast forward and say my husband and I are vaccinated; our son isn't. How safe are family gatherings with lots of unvaccinated children since they're too little to receive the vaccine? Am I too paranoid? I'm nervous to take my son around his little cousins. He only has masked play dates so far, or sees the one child up the street whose parents are like us---huper vigilant. I just don't know what to do some days and could really use advice. 

Sorry if this is more of a rant. I'm just struggling with COVID depression. We moved at the height of the pandemic so I barely have gotten acclimated with our new area and I feel very isolated. My neighbors do a lot of local events but they've all ditch the masks which freaks me out. As a collective whole, they've basically said EFF masks and boast this on social media. We live in a small rural town with not much to do. We're part of homeschool groups that have masked play dates, which does help with the isolation. Again, sorry to vent! 

Thanks :)",1619120484
6081e46b2ca45504c455a4ab,,false,"A. Don’t cry if you catch covid
B. Don’t cry if you can’t travel to other countries because your country has a bad reputation with their high covid cases
C. Don’t cry if your favorite entertainers, restaurants,  shops, etc. run out of business due to the pandemic 
D. Don’t cry if you lose your job because of the pandemic 
E. Don’t cry if the pandemic lasts for another 7-10 years

The choice is yours.",1619079289
6081e46b2ca45504c455a4ac,,false,"Anyone else out there trying to cope with a loved one who's into Covid conspiracy theories? It's on the point of tearing my relationship apart. I've read a lot about this happening with QAnon loved ones but am looking for people going through something similar with Covid.",1619116481
6081e46b2ca45504c455a4ad,,false,"Oakland County, MI disabled &amp; elder residents need your help! All access to the COVID vaccine has been suspended for those who are homebound, at this time.

We need help getting this information to the right people, so vaccines can resume!

Why are they not offering Pfizer or Moderna, and why were they only scheduling appointments two days a week?

[https://www.tiktok.com/@thecripcrusader/video/6954081246972595462?lang=en&amp;is\_copy\_url=0&amp;is\_from\_webapp=v1&amp;sender\_device=pc&amp;sender\_web\_id=6896635150605583878](https://www.tiktok.com/@thecripcrusader/video/6954081246972595462?lang=en&amp;is_copy_url=0&amp;is_from_webapp=v1&amp;sender_device=pc&amp;sender_web_id=6896635150605583878)",1619124471
6081e46b2ca45504c455a4ae,,false,"Hi all, 

Been browsing this subreddit for a few days leading up to my vaccination (1st dose). Just letting y’all know that I just received the Pfizer, and am waiting in the 15min recommended area by the pharmacy. The shot was literally senseless and quick, I didn’t feel any prick or poke or anything. 

I completely understand people being hesitant and skeptical and anxious, however I have been following the data for some time (I am a psychologist), and the overall benefit is well worth the potential risks. Read people’s stories on here, you don’t want COVID. Regardless if you have the perspective of “you have a 99.99% of living”, people who contracted and lived MAY live now with some sort of chronic illness. Please be mindful of that. I wish you all well and I will follow up tonight (it’s 1:15 PST).",1619122567
6081e46b2ca45504c455a4af,,false,"I'm in Canada. My province will soon be done with the 1st shots for people aged 45 and more.

Today they announced obese people will be able to book their appointment.

My BMI is 35. I am technically obese, but I see myself more like a chubby guy I guess. And I'm 32. I work from home but my son goes to daycare and my daughter should be back in school on May 3.

My wife says I should get the shot because I meet the criteria on paper and so it means I have increased risk and I should not consider myself immune because I WFH. But I don't want to take someone else's place and I'm sort of afraid I'll be judged by the people there.

Should I wait for my age group, or take the obese pass?",1619122523
6081e46b2ca45504c455a4b0,,false,"Hello all! I have a strange issue that I would love some input from the reddit hivemind. 

I live in the US and go to grad school in the caribbean. I came home because we were doing online classes but need to go back at the beginning on May to start in person classes again. The island has extremely strict quarantine for incoming people and the island currently has no person to person covid cases (things are almost completely back to normal). They only have access to the astrazenica vaccine. At home my state didn't allow healthy young people to get the vaccine till recently ( like.. I just got the email that I'm allowed to get the vaccine) but if I get the first dose of either of the other two vaccines, I won't be in the states long enough to get the booster (leaving in less than 20 days) and won't be coming back till sometime in 2022. 

So do I get the first vaccine of the pfizer/moderna even though I can't get the booster until months later, or do I wait and get the astrazenica one, even though it doesn't offer as high of protection and there is a tiny risk of clotting?",1619113622
6081e46b2ca45504c455a4b1,,false,"I live in India and COVID is going absolutely crazy here. 
Is it safe to go out for a walk within my gated colony wearing a mask and making sure to avoid the few people who are also out?

Very easy to say that this should not be a priority during the pandemic, but I know what a walk does for my physical and mental health. I remember that during the first lockdown we weren't allowed to go out, but lockdowns in Western countries allowed one to go out and exercise.",1619112587
6081e46b2ca45504c455a4b3,,false,"Hi! I recieved my first dose 3 weeks ago of Pfizer, getting my second in a few hours and I’m terrified. Instantly my throat felt a little closed but subsided within an hour, however my face and tongue were itchy but not swollen, no rash, subsided in half an hour, but after an hour I felt almost drugged until the next day. I’m terrified but need my second dose due to work, any recommendations or precautions I should take?",1619107224
6081e46b2ca45504c455a4b4,,false,"I noticed I can still smell, but foods are tasting a little flat. Could this be the covid related lack of smells and taste? 

What did it feel like to you?",1619103449
6081e46b2ca45504c455a4b5,,false,"I got my second shot on Tuesday and by Wednesday I felt like crap. I had a low-grade fever, the chills, and an overall sense of feeling like crap. Today, Thursday, I feel a whole lot better but not great. I figure that by tomorrow I'll be back to my normal self.

Damn am I glad that I decided to take an extra day off of work this week.

I got the Moderna shot for those that may be asking.",1619098269
6081e46b2ca45504c455a4b6,,false,"So,

Tuesday night, I started feeling nauseous then vomited for 6 hours. I got in bed, horrible leg cramps, body aches, and chills and finally went to sleep. I woke up with chest pain , severe headache and a sore spine, my back is killing. Took a 2 hr nap ( I usually can never get myself to nap) and was only able to eat a smoothie and bagel. Went to sleep ok last night but started feeling congested. Woke up today and my back and chest are so sore, as if I did a hard workout. Some other members of my family have had similar symptoms since Saturday, but mine are the most severe. I’m not sure if anyone else has experienced vomiting with covid or if this is just the stomach flu?",1619092207
6081e46b2ca45504c455a4b7,,false,"Before you judge me, I have MASSIVE anxiety and am autistic (so I sometimes don't hear my body telling me something, ie don't notice when I'm hungry or need to pee) so I just really wanted to get some outside opinions. Also in case it matters, I'm in the UK. Just mentioning it as everyone always assumes everyone on the Internet is American lol, and covid rules do differ per country at times. 

I have never had covid symptoms, but took a test last weekend as I was asked to by the council (everyone in my area was asked). This came back on Monday as negative.
I also started taking pills for my allergy to dust on Monday and have taken one pill every morning since.

Since Monday my nose has been blocked at times and I can feel mucus build up at the back of my throat. I don't really feel the need to cough unless I laugh, inhale too sharply, or try to sing a song that's too high for my voice lol. I'm also a smoker and that has been fine so far.

I don't know if this could be covid (I cough but I wouldn't call it continuous? But then I'm not even sure what continuous means, I might take it too literally), I don't have a temperature as far as I know and I can smell and taste just fine.
I figured it might be a side effect from the allergy pills considering the timing, though it isn't mentioned as one on the info pamphlet.

Surely my luck can't be so bad that I'm fine for more than a year and then two days after I take my first test, catch it?",1619092005
6081e46b2ca45504c455a4b8,,false,"My parents are taking their vaccine this weekend and i am a bit concerned.

Is it true that after vaccine 1st dose, your immunity is at zero hence you have to be all the more careful till you get your next shot? Which for us Canadians would be after 3-4 months. So what does that mean? Do they completely isolate during this time? I live with my parents so from 3 of us, 1 that is me will be without vaccine. 

My mom has her dental appointment next week and is expected to get a root canal, so now we are confused if it will be ok for her to go to clinic after her 1st shot. Also, what are some of the meds we should keep at home in case they feel any side effects from the vaccine?

Can someone please shed some light on this?",1619087492
6081e46b2ca45504c455a4b9,,false,I’m 17 turning 18 in a couple of months. Can I book an appointment in advance so that when I turn 18 I can get it immediately? My parents are anti-vax and won’t give parental consent.,1619058107
6081e46b2ca45504c455a4b2,,false,I got my first shot last Friday and the past couple of days I’ve feel super lethargic and kinda feel like I have a head cold. I’m not sure if I should attribute this to the shot or just from feeling burnt out at work or a mixture of the two. Does anyone know if it’s common to have symptoms a week after your first shot?,1619111098
6081e511f2599a3ef4fc40eb,,false,"I'm hoping to get advice. My friend keeps putting down the vaccines. I haven't gotten mine yet (but until I do, I stay home, have groceries delivered, and don't really see anyone because I want to be safe until I'm vaccinated). She's constantly sending me messages saying incredibly disparaging things about the vaccine. I understand we're entitled to our opinions, but it makes me uncomfortable because I don't push my views on others. 

I have a child, whereas she doesn't. I've tried to explain that I need to protect my child as best I can by doing my part in staying safe. She carries on by saying the vaccine is Big Pharma controlling us (which aggravates me because my husband works for a pharmaceutical company), the vaccine has a microchip in it (meanwhile she carries a cell phone with GPS) and that the government is trying to harm us with the vaccine...because........it's a gut feeling of hers. Sigh.

What do I say? Sell crazy some place else?

I'm running out of steam with her. It's to the point where we argue because I have to tell her over and over that opinions are like assholes---we all have them. Alas, every day or so it's another bizarre text message about mind control. She wants to come visit us and I said no. I'm just tired of the same conversation. 

My parents have similar view points (not about mind control, just that they feel there's not enough evidence to support the safety of these vaccines so they won't get them). Meanwhile, they see neighbors and friends and it makes me uneasy because they don't socially distance. But it's their choice, so I can't do or say anything. It's also depressing me because they haven't seen us since October and only a handful of times outdoors before that, and they're missing out on their grandson during his toddler years when everything is new and exciting for him. It really bums me out. But I'm doing what I feel is right, and I'm keeping my son away from them because they don't take COVID seriously in my opinion. To each their own, but I have a responsibility to my family and until we're vaccinated, I have to keep my trio safe. My son and husband are my priority. 

I'm also unsure about some family gatherings on the horizon. Fast forward and say my husband and I are vaccinated; our son isn't. How safe are family gatherings with lots of unvaccinated children since they're too little to receive the vaccine? Am I too paranoid? I'm nervous to take my son around his little cousins. He only has masked play dates so far, or sees the one child up the street whose parents are like us---huper vigilant. I just don't know what to do some days and could really use advice. 

Sorry if this is more of a rant. I'm just struggling with COVID depression. We moved at the height of the pandemic so I barely have gotten acclimated with our new area and I feel very isolated. My neighbors do a lot of local events but they've all ditch the masks which freaks me out. As a collective whole, they've basically said EFF masks and boast this on social media. We live in a small rural town with not much to do. We're part of homeschool groups that have masked play dates, which does help with the isolation. Again, sorry to vent! 

Thanks :)",1619120484
6081e511f2599a3ef4fc40ec,,false,"A. Don’t cry if you catch covid
B. Don’t cry if you can’t travel to other countries because your country has a bad reputation with their high covid cases
C. Don’t cry if your favorite entertainers, restaurants,  shops, etc. run out of business due to the pandemic 
D. Don’t cry if you lose your job because of the pandemic 
E. Don’t cry if the pandemic lasts for another 7-10 years

The choice is yours.",1619079289
6081e511f2599a3ef4fc40ed,,false,"Anyone else out there trying to cope with a loved one who's into Covid conspiracy theories? It's on the point of tearing my relationship apart. I've read a lot about this happening with QAnon loved ones but am looking for people going through something similar with Covid.",1619116481
6081e511f2599a3ef4fc40ee,,false,"Oakland County, MI disabled &amp; elder residents need your help! All access to the COVID vaccine has been suspended for those who are homebound, at this time.

We need help getting this information to the right people, so vaccines can resume!

Why are they not offering Pfizer or Moderna, and why were they only scheduling appointments two days a week?

[https://www.tiktok.com/@thecripcrusader/video/6954081246972595462?lang=en&amp;is\_copy\_url=0&amp;is\_from\_webapp=v1&amp;sender\_device=pc&amp;sender\_web\_id=6896635150605583878](https://www.tiktok.com/@thecripcrusader/video/6954081246972595462?lang=en&amp;is_copy_url=0&amp;is_from_webapp=v1&amp;sender_device=pc&amp;sender_web_id=6896635150605583878)",1619124471
6081e511f2599a3ef4fc40ef,,false,"Hi all, 

Been browsing this subreddit for a few days leading up to my vaccination (1st dose). Just letting y’all know that I just received the Pfizer, and am waiting in the 15min recommended area by the pharmacy. The shot was literally senseless and quick, I didn’t feel any prick or poke or anything. 

I completely understand people being hesitant and skeptical and anxious, however I have been following the data for some time (I am a psychologist), and the overall benefit is well worth the potential risks. Read people’s stories on here, you don’t want COVID. Regardless if you have the perspective of “you have a 99.99% of living”, people who contracted and lived MAY live now with some sort of chronic illness. Please be mindful of that. I wish you all well and I will follow up tonight (it’s 1:15 PST).",1619122567
6081e511f2599a3ef4fc40f0,,false,"I'm in Canada. My province will soon be done with the 1st shots for people aged 45 and more.

Today they announced obese people will be able to book their appointment.

My BMI is 35. I am technically obese, but I see myself more like a chubby guy I guess. And I'm 32. I work from home but my son goes to daycare and my daughter should be back in school on May 3.

My wife says I should get the shot because I meet the criteria on paper and so it means I have increased risk and I should not consider myself immune because I WFH. But I don't want to take someone else's place and I'm sort of afraid I'll be judged by the people there.

Should I wait for my age group, or take the obese pass?",1619122523
6081e511f2599a3ef4fc40f1,,false,"Hello all! I have a strange issue that I would love some input from the reddit hivemind. 

I live in the US and go to grad school in the caribbean. I came home because we were doing online classes but need to go back at the beginning on May to start in person classes again. The island has extremely strict quarantine for incoming people and the island currently has no person to person covid cases (things are almost completely back to normal). They only have access to the astrazenica vaccine. At home my state didn't allow healthy young people to get the vaccine till recently ( like.. I just got the email that I'm allowed to get the vaccine) but if I get the first dose of either of the other two vaccines, I won't be in the states long enough to get the booster (leaving in less than 20 days) and won't be coming back till sometime in 2022. 

So do I get the first vaccine of the pfizer/moderna even though I can't get the booster until months later, or do I wait and get the astrazenica one, even though it doesn't offer as high of protection and there is a tiny risk of clotting?",1619113622
6081e511f2599a3ef4fc40f2,,false,"I live in India and COVID is going absolutely crazy here. 
Is it safe to go out for a walk within my gated colony wearing a mask and making sure to avoid the few people who are also out?

Very easy to say that this should not be a priority during the pandemic, but I know what a walk does for my physical and mental health. I remember that during the first lockdown we weren't allowed to go out, but lockdowns in Western countries allowed one to go out and exercise.",1619112587
6081e511f2599a3ef4fc40f3,,false,I got my first shot last Friday and the past couple of days I’ve feel super lethargic and kinda feel like I have a head cold. I’m not sure if I should attribute this to the shot or just from feeling burnt out at work or a mixture of the two. Does anyone know if it’s common to have symptoms a week after your first shot?,1619111098
6081e511f2599a3ef4fc40f4,,false,"Hi! I recieved my first dose 3 weeks ago of Pfizer, getting my second in a few hours and I’m terrified. Instantly my throat felt a little closed but subsided within an hour, however my face and tongue were itchy but not swollen, no rash, subsided in half an hour, but after an hour I felt almost drugged until the next day. I’m terrified but need my second dose due to work, any recommendations or precautions I should take?",1619107224
6081e511f2599a3ef4fc40f5,,false,"I noticed I can still smell, but foods are tasting a little flat. Could this be the covid related lack of smells and taste? 

What did it feel like to you?",1619103449
6081e511f2599a3ef4fc40f6,,false,"I got my second shot on Tuesday and by Wednesday I felt like crap. I had a low-grade fever, the chills, and an overall sense of feeling like crap. Today, Thursday, I feel a whole lot better but not great. I figure that by tomorrow I'll be back to my normal self.

Damn am I glad that I decided to take an extra day off of work this week.

I got the Moderna shot for those that may be asking.",1619098269
6081e511f2599a3ef4fc40f7,,false,"So,

Tuesday night, I started feeling nauseous then vomited for 6 hours. I got in bed, horrible leg cramps, body aches, and chills and finally went to sleep. I woke up with chest pain , severe headache and a sore spine, my back is killing. Took a 2 hr nap ( I usually can never get myself to nap) and was only able to eat a smoothie and bagel. Went to sleep ok last night but started feeling congested. Woke up today and my back and chest are so sore, as if I did a hard workout. Some other members of my family have had similar symptoms since Saturday, but mine are the most severe. I’m not sure if anyone else has experienced vomiting with covid or if this is just the stomach flu?",1619092207
6081e511f2599a3ef4fc40f8,,false,"Before you judge me, I have MASSIVE anxiety and am autistic (so I sometimes don't hear my body telling me something, ie don't notice when I'm hungry or need to pee) so I just really wanted to get some outside opinions. Also in case it matters, I'm in the UK. Just mentioning it as everyone always assumes everyone on the Internet is American lol, and covid rules do differ per country at times. 

I have never had covid symptoms, but took a test last weekend as I was asked to by the council (everyone in my area was asked). This came back on Monday as negative.
I also started taking pills for my allergy to dust on Monday and have taken one pill every morning since.

Since Monday my nose has been blocked at times and I can feel mucus build up at the back of my throat. I don't really feel the need to cough unless I laugh, inhale too sharply, or try to sing a song that's too high for my voice lol. I'm also a smoker and that has been fine so far.

I don't know if this could be covid (I cough but I wouldn't call it continuous? But then I'm not even sure what continuous means, I might take it too literally), I don't have a temperature as far as I know and I can smell and taste just fine.
I figured it might be a side effect from the allergy pills considering the timing, though it isn't mentioned as one on the info pamphlet.

Surely my luck can't be so bad that I'm fine for more than a year and then two days after I take my first test, catch it?",1619092005
6081e511f2599a3ef4fc40f9,,false,"My parents are taking their vaccine this weekend and i am a bit concerned.

Is it true that after vaccine 1st dose, your immunity is at zero hence you have to be all the more careful till you get your next shot? Which for us Canadians would be after 3-4 months. So what does that mean? Do they completely isolate during this time? I live with my parents so from 3 of us, 1 that is me will be without vaccine. 

My mom has her dental appointment next week and is expected to get a root canal, so now we are confused if it will be ok for her to go to clinic after her 1st shot. Also, what are some of the meds we should keep at home in case they feel any side effects from the vaccine?

Can someone please shed some light on this?",1619087492
6081e511f2599a3ef4fc40fa,,false,I’m 17 turning 18 in a couple of months. Can I book an appointment in advance so that when I turn 18 I can get it immediately? My parents are anti-vax and won’t give parental consent.,1619058107
