_id,category,isTwitter,text,timeCreated
6071ddd8a738ac5d909660b2,,false,"**COVID-19**

All your usual COVID discussion is welcome. But also remember, /r/coronavirusuk, where you can be with fellow obsessives.

**Mod Update**

As some of our more eagle-eyed users may have noticed, we have added a new rule: No Personal Attacks.  As a result of a number of vile comments, we have felt the need to remind you all to not attack other users in your comments, rather focus on what they've written and that particularly egregious behaviour will result in appropriate action taking place.  Further, a number of other rules have been rewritten to help with clarity.

**Weekly Freetalk**

How have you been? What are you doing? Tell us Internet strangers, in excruciating detail!

We will maintain this submission for ~7 days and refresh iteratively :). Further refinement or other suggestions are encouraged. Meta is welcome. But don't expect mods to spring up out of nowhere.

**Sorting**

On the web, we sort by New. Those of you on mobile clients, suggest you do also!",1617612314
6071ddd8a738ac5d909660b3,,false,"With the announcement of HRH Prince Phillip's Death, we've created a megathread for discussion, articles and commentary about the matter. 

We will try to add links to main news outlets as and when they surface. 


**Announcement from the Royal Family themselves:** 
https://twitter.com/RoyalFamily/status/1380475865323212800?ref_src=twsrc%5Egoogle%7Ctwcamp%5Eserp%7Ctwgr%5Etweet

**BBC Coverage:**
https://www.bbc.co.uk/news/uk-11437314

Or you can dial in to BBC and listen 03333660937 (from the US 011443333660937)

**Sky News Coverage:** https://news.sky.com/story/the-duke-of-edinburgh-prince-philip-has-died-12270325

**Guardian Coverage:** 
https://www.theguardian.com/uk-news/live/2021/apr/09/prince-philip-duke-of-edinburgh-dies-latest-updates

**Telegraph Coverage:**
https://www.telegraph.co.uk/royal-family/2021/04/09/prince-philip-dead-latest-news-live-updates-duke-edinburgh-queen/


**Whilst we all have different views on the monarchy please do not devolve to insulting others.  Please report any offending comments in the usual manner and any abusive DMs through [Reddit's report form](https://www.reddit.com/report).**",1617966493
6071df16840e1f541c7970e2,,false,"Not sure if this post is allowed, but I can definitely delete if needed. I'm researching this topic for an online ""blog/journal,"" and wanted to get some perspective. A reddit comment would be great, but if anyone is willing to take it further for a 10-15 minute interview, that would be even better.",1618067591
6071df16840e1f541c7970e3,,false,"So I'm going to ask a simple but complex question. Not gonna say where I sit, what my politics are what my personal angle is, I just want to ask you all a simple but complex question that we can all universally answer hopefully without too much confrontation. My question is this, how much longer are you okay with dealing with lockdowns, quarantines, masks in public, basically covid. How long until you are personally fed up? Nobody I'm sure wants to live like this forever and just about every politician will take an inch and run a mile with it. No answer is wrong or right I just wanna know where everyone else sits on this subject.",1618035369
6071df16840e1f541c7970e4,,false,"I was going to post this in my local forums, but I didn't want to accidentally start a situation with antivaxxers or  start some kind of other debate. Here looks like a good place to ask.

I plan on getting vaccinated at some point, and no one can talk me out of it. This is not a question of efficacy or science vs BS, this is a question about ethics.

So a bit of background:

The country I live in has had a horrible vaccine rollout. Absolutely awful. As a result, we have a limited number of doses, and we're prioritizing at-risk populations.

I live in the most densely populated city in my country. As of a couple of days ago, they've begun opening up the vaccinations to any adult over 18, in what they designate as 'hot spots'. I live in a 'hot spot'.

I'm under 30 and by all accounts pretty healthy. I've been privileged enough to have stable housing and to have the ability to work from home for the duration  of the pandemic. And I know that vaccination won't suddenly make it so that I can see my family/friends again. My partner, who I live with, also doesn't have to go anywhere to work, so we're both at home and safe, aside from a weekly grocery trip.

Here's my quandary:

With vaccines being in such limited supply where I am, I truly believe that frontline workers, obviously healthcare folks, anyone in retail, food-service, factory/construction workers, basically anyone that needs to come into contact with other humans should be prioritized. Statistically where I live, workplace breakouts are responsible for so much of the spread, and those people deserve to be safe.

I also know that the more people who are vaccinated overall means generally better things. And while my risk is low, I can still catch it on those weekly grocery trips.

I feel like getting vaccinated now would steal doses from the people that really need them. But I also want to contribute to the overall lowering of the risk of serious illness/spread, and take potential pressure off of the overwhelmed hospital system in my area if I was to contract covid.

With all that being said... Should I get vaccinated now/ASAP? Or should I wait until more people have gotten it so that I'm not depriving a cashier or frontline worker of their chance to get vaccinated? 

I'm really torn. Any help is appreciated.",1618023071
6071df16840e1f541c7970e5,,false,Hi! We are currently conducting a Webinar on COVID-19 vaccines. If you are free. Feel free to join. [https://us02web.zoom.us/j/81139225143?pwd=K2FqdXdIWS9mMHJxR2FSVDViSGhZZz09](https://us02web.zoom.us/j/81139225143?pwd=K2FqdXdIWS9mMHJxR2FSVDViSGhZZz09),1618051517
6071df16840e1f541c7970e6,,false,"Hi yall, my roommate and I share a tiny apartment and there's not much space for us to keep to ourselves in it. She just tested positive but I'm fully vaccinated (Moderna), should I quarantine as well? I couldn't find a clear protocol on this.

The CDC says fully vaccinated folks with exposure and no symptoms don't have to quarantine, but I don't want to put unvaccinated folks in danger.",1618004779
6071df16840e1f541c7970e7,,false,"So my appointment is on the 25th but a pharmacy just sent a notice I can book now for the Astrazenka vaccine as early as the 14th. Phizer is more effective without any side effects known but we're in the middle of escalating cases here which has started a new lockdown because they are threatening to overwhelm hospitals.  On the other hand I work at home alone and don't need to go anywhere but for groceries (nor is it legal to go anywhere else).  Pfizer and Moderna are 95% effective while AZ is more like 65%. Mind you, that's after two doses and our government has pushed the second dose back for four months... 

I'm inclined to wait the extra 11 days but unsure... Not a ton is known for sure about effectiveness after one dose.",1618021605
6071df16840e1f541c7970e8,,false,"I'm due in July and I'm trying to figure out what precautions to take with myself &amp; our newborn after birth with regards to family.

We want our immediate families to meet the baby (around 10 people total) and they'd all be vaccinated but most would not be able to quarantine before. Half would be flying in. 

We've been incredibly strict this past year with me being pregnant &amp; choosing not to get vaccinated at the moment. I'd love to hear what other parents are doing with regard to safety precautions with a newborn. I'd also be unvaccinated at the time of birth. I'm hoping to get vaccinated immediately after.

\*Please no comments on personal opinions on COVID/the vaccine. Thank you!",1618009249
6071df16840e1f541c7970ea,,false,"With mask mandates slowly starting to come to an end, will you continue to wear a mask when  it ends?

*mask mandate in my area ends Monday*

[View Poll](https://www.reddit.com/poll/mnj5vm)",1617980662
6071df16840e1f541c7970e9,,false,Has anyone seen data on mixing vaccine brands? I was able to get 1st dose of Pfizer on March 5 while in the US. I’m now back home (outside of the US) and can get the AstraZeneca vaccine. I am hesitant since I haven’t been able to find much data on it. Thoughts?,1618007597
6071df16840e1f541c7970eb,,false,"Hi not sure if I’ve posted this in the right area but— 

When arriving In the UK, a PCR COVID test is needed as evidence. 

I was wondering whether a test called RT-PCR is the same thing? Would it still be accepted?",1618005857
6071df16840e1f541c7970ec,,false,"He had test 31th march covid positive yesterday his test was negative he was symptome free and he said I feel good , we had a dinner together in a car , should I be worried about getting covid again ? I had covid 5 months ago and recocered well",1617995013
6071df16840e1f541c7970ed,,false,"The “most neglected” beings are not only the “food” in the system, but also what we “humans” classify as “destroyers” &amp; “killers”, basically our “enemies”.

I am talking about the “insects” that destroy crops &amp; the “viruses” &amp; “bacteria” that try to hurt us &amp; kill us.

From a selfish subjective view, yes, we should destroy them before they destroy us.

However, from a unselfish nonsubjective view, did they get to decide what they are?

Their existence is immoral to them just like our existence is immoral to us.

I don’t think anyone of us really get to pick what we are but we are what we are and we’re just trying to live.

Remember that.

This is where our ability to “empathize” as “human beings” with other beings in the system comes in...

Let’s think this from their views.

What seems “wrong” to us is “not wrong” to them.

They might be “amoral” &amp; lacking a “moral sense” to know what they are doing is “wrong” (they just trying to live) nor they can communicate with us to let us know they’re trying to do less of it because they realize it is “wrong”.

Unlike them, as “human beings”, we have a “moral sense” that help us determine what we could be doing seems “wrong” so we could work on doing less of it or stop doing it.

Therefore, when we destroy them “for survival” is NOT morally justified either.

It is just “immoral” to do anything to any living beings “without their consent” (regardless if they can give consent or not or what the do to us).

It is also NOT “humane” either.

Humane is when you stop something from hurting you without hurting it.

That is “humane”.

Now let’s switch the “destroyer” &amp; “killer” to a human form of a “serial killer”.

Yes. It’s immoral what “he” or “she” is doing (I purposely include both pronouns to not discriminate males).

They are being “immoral” by ending people’s existence “without their consent”, doesn’t matter how horrible the people they killed are.

But we shouldn’t be ending their existence without their consent either (even though my vengeance side say you deserve wtf you do to others so that you’ll know how they feel depending on the situation).

That is not to say, I will not imprison them for breaking the law and to prevent them from harming other people.

But I will not feed them “food” that stem from any other living beings that also want to live (it’s not my responsibility to feed them anyway, in nature they are supposed to find their own food).

That’s just NOT fair nor humane to those beings that are “food”.

If you are a human being, an animal, a plant, or other living beings, why the fk should you die for them without your consent?

That is NOT fair nor humane to you.

If plants don’t feel “pain” nor “care about their existence” then I “might” give them up as “food” just because “pain” wins.

NOT because I value human’s life over plant’s life.

They all have equal “inherent living rights” to me because they are all “alive”.

But if plants do feel “pain” or “care about their existence” or any other “food” that is also like that, then I will just leave the criminals alone (not to die, or to starve, but just alone).

I will not prioritize their “life” over others’ life as a “human being” just because I am brainwashed by society to do so.

Yes, I am being immoral to them in a way because I am not allowing them to go find food by locking them up (but that is why they shouldn’t be breaking the law).

But it will be less immoral to everything else overall that also “live” because they also deserve a chance at life too.

I will give the criminals “water” however since water is “non-living”.

Anyway, as a “human being”, I will always go for whatever I think is less immoral to all beings, not just the one that I was set up by society to be brainwashed for.

I would also request for a way for them to end their existence “without any pain &amp; any suffering” that comes from NOTHING that is “alive” &amp; give them that option.

You could argue that the serial killer don’t want to be a serial killer either and is just doing what they are set out to do by creations.

True, but they have the “option” of getting help to prevent or limit their actions therefore they should try to seek it if they want “empathy”.

They have a “choice” as a person. But animals, plants, insects, bacteria, &amp; viruses “might” not.

That’s the difference.

As a last note, while in prison, the criminals could also request whatever they want that is “not alive” and I “might” consider giving that to them.

This is my current thought for now.

It might change as I think more about it.

\*I don’t like how Google Translate dehumanize “criminals” and “other living beings” when I use it either. Google have to work on this.

\----------------------------------------------------------------------------------------------------------------------------------------------

I thought some more about this and there are a few things I want to add.

1. When insects destroy “crops”, remember the “crops” are not ours.   
We own “nothing” in this system.  

We arrived into this world “empty handed”. Remember that.

Humans basically steal and manipulate plants into “crops” for our own use.   
Insects are stealing from “plants” just like humans are. 

We’re both “thieves” so why are we hating them for? 

2. “Viruses” &amp; “Bacteria” try to hurt us and kill us...

But we do the same shit to “animals” &amp; “plants” for survival too so why are we hating them for doing exactly what we are doing?

What makes you think “animals” &amp; “plants” don’t value their own life?  
Anyone that claim that they don’t are just ignorant and selfish af.

You just care about what you want and don’t give a fk about what other species want. 

Wtf makes you think our “inherent living rights” are more worthy than theirs?

I don’t think so. 

As a “human being”, I truly believe that everything that is “alive” have “equal inherent living rights”.

That’s “morality” to me. 

3. If it’s “immoral” for the criminals to eat the things that are “alive” that “could also feel pain”, then what about me? 

How is that fair that I get to eat them and the criminals do not?  
It’s not fair. 

I shouldn’t be eating things that are “alive” either especially if they feel “pain”.

That’s inhumane af. 

So if what we are eating DO NOT feel pain, then both me and the criminals will get to eat them (regardless if they care about their existence or not) just because “pain” wins (fk “pain”).

But if what we are eating DO FEEL pain, I would probably to choose to end my existence without any pain &amp; any suffering too just to be a “human being”. 

Once again, fk creations for this existence bullshit. 

It was a trap for us to be immoral for existence since as “human beings” we have a “moral sense”.

Even if we don’t eat, we’re always constantly killing something as long as we are alive it seems like.

This is why my mom should have never brought me into this stupid world where “pain” &amp; “immorality” exist. 

Hella shady existence. 

I could never be “moral” in this world no matter wtf I do it seems like...  
But I could still be a “human being” by trying to be as least “immoral” as I could while alive.

I guess that’s fine with me (for now).",1618005114
6071df16840e1f541c7970ee,,false,"Right now on Ybor city, Tampa",1617991021
6071df16840e1f541c7970f0,,false,"**Would you allow someone at your wedding who isn't vaccinated for COVID? Our wedding got pushed back from last year because of COVID and is rescheduled for the fall. I have heart disease and am at risk, but really struggling with allowing people who aren't vaccinated. Am I wrong by not wanting them?**",1618000439
6071df16840e1f541c7970f1,,false," Canada, which previously seemed to control the coronavirus far better than its neighbor to the south, now finds itself in the grip of fast-spreading variants in its most populous provinces. Ontario reported an average of...

[READ FULL ARTICLE](http://canadazopom.tk/breaking-flash-news-canada)",1617984275
6071df16840e1f541c7970ef,,false,"I have an appointment for jnj Monday, but I'm set on cancelling it because of the 3 clinics that have closed due to people having adverse reactions to the vaccine (landed some in the hospital). 
Long story short, I don't like needles. I don't need the judgement, that's why I wanted the jnj. 

I recently saw an article where 1 dose of Pfizer/Moderna gives 80% protection. Wouldn't I be better off with one dose of one of those, as compared to one dose of jnj?

https://www.google.com/amp/s/www.cnbc.com/amp/2021/03/29/cdc-study-shows-single-dose-of-pfizer-or-moderna-covid-vaccines-was-80percent-effective.html",1617989031
6071df16840e1f541c7970f2,,false,"I've heard studies saying that decreased sleep before the vaccine decreases effectiveness, makes sense since better and more sleep = stronger immune system to generate antibodies. I have my vaccine appointment tomorrow but I haven't been getting good sleep this past week. This might sound paranoid but would it be beneficial for me to postpone my vaccine appointment until I can get a better night's sleep to ensure high effectiveness or would you recommend just taking it tomorrow?",1617977614
6072032338cf7f163050e77d,unknown,null,"**COVID-19**

All your usual COVID discussion is welcome. But also remember, /r/coronavirusuk, where you can be with fellow obsessives.

**Mod Update**

As some of our more eagle-eyed users may have noticed, we have added a new rule: No Personal Attacks.  As a result of a number of vile comments, we have felt the need to remind you all to not attack other users in your comments, rather focus on what they've written and that particularly egregious behaviour will result in appropriate action taking place.  Further, a number of other rules have been rewritten to help with clarity.

**Weekly Freetalk**

How have you been? What are you doing? Tell us Internet strangers, in excruciating detail!

We will maintain this submission for ~7 days and refresh iteratively :). Further refinement or other suggestions are encouraged. Meta is welcome. But don't expect mods to spring up out of nowhere.

**Sorting**

On the web, we sort by New. Those of you on mobile clients, suggest you do also!",1617612314
6072032338cf7f163050e77e,positive,null,"With the announcement of HRH Prince Phillip's Death, we've created a megathread for discussion, articles and commentary about the matter. 

We will try to add links to main news outlets as and when they surface. 


**Announcement from the Royal Family themselves:** 
https://twitter.com/RoyalFamily/status/1380475865323212800?ref_src=twsrc%5Egoogle%7Ctwcamp%5Eserp%7Ctwgr%5Etweet

**BBC Coverage:**
https://www.bbc.co.uk/news/uk-11437314

Or you can dial in to BBC and listen 03333660937 (from the US 011443333660937)

**Sky News Coverage:** https://news.sky.com/story/the-duke-of-edinburgh-prince-philip-has-died-12270325

**Guardian Coverage:** 
https://www.theguardian.com/uk-news/live/2021/apr/09/prince-philip-duke-of-edinburgh-dies-latest-updates

**Telegraph Coverage:**
https://www.telegraph.co.uk/royal-family/2021/04/09/prince-philip-dead-latest-news-live-updates-duke-edinburgh-queen/


**Whilst we all have different views on the monarchy please do not devolve to insulting others.  Please report any offending comments in the usual manner and any abusive DMs through [Reddit's report form](https://www.reddit.com/report).**",1617966493
6072032338cf7f163050e77f,negative,null,"Not sure if this post is allowed, but I can definitely delete if needed. I'm researching this topic for an online ""blog/journal,"" and wanted to get some perspective. A reddit comment would be great, but if anyone is willing to take it further for a 10-15 minute interview, that would be even better.",1618067591
6072032338cf7f163050e780,unknown,null,"So I'm going to ask a simple but complex question. Not gonna say where I sit, what my politics are what my personal angle is, I just want to ask you all a simple but complex question that we can all universally answer hopefully without too much confrontation. My question is this, how much longer are you okay with dealing with lockdowns, quarantines, masks in public, basically covid. How long until you are personally fed up? Nobody I'm sure wants to live like this forever and just about every politician will take an inch and run a mile with it. No answer is wrong or right I just wanna know where everyone else sits on this subject.",1618035369
6072032438cf7f163050e781,positive,null,"I was going to post this in my local forums, but I didn't want to accidentally start a situation with antivaxxers or  start some kind of other debate. Here looks like a good place to ask.

I plan on getting vaccinated at some point, and no one can talk me out of it. This is not a question of efficacy or science vs BS, this is a question about ethics.

So a bit of background:

The country I live in has had a horrible vaccine rollout. Absolutely awful. As a result, we have a limited number of doses, and we're prioritizing at-risk populations.

I live in the most densely populated city in my country. As of a couple of days ago, they've begun opening up the vaccinations to any adult over 18, in what they designate as 'hot spots'. I live in a 'hot spot'.

I'm under 30 and by all accounts pretty healthy. I've been privileged enough to have stable housing and to have the ability to work from home for the duration  of the pandemic. And I know that vaccination won't suddenly make it so that I can see my family/friends again. My partner, who I live with, also doesn't have to go anywhere to work, so we're both at home and safe, aside from a weekly grocery trip.

Here's my quandary:

With vaccines being in such limited supply where I am, I truly believe that frontline workers, obviously healthcare folks, anyone in retail, food-service, factory/construction workers, basically anyone that needs to come into contact with other humans should be prioritized. Statistically where I live, workplace breakouts are responsible for so much of the spread, and those people deserve to be safe.

I also know that the more people who are vaccinated overall means generally better things. And while my risk is low, I can still catch it on those weekly grocery trips.

I feel like getting vaccinated now would steal doses from the people that really need them. But I also want to contribute to the overall lowering of the risk of serious illness/spread, and take potential pressure off of the overwhelmed hospital system in my area if I was to contract covid.

With all that being said... Should I get vaccinated now/ASAP? Or should I wait until more people have gotten it so that I'm not depriving a cashier or frontline worker of their chance to get vaccinated? 

I'm really torn. Any help is appreciated.",1618023071
6072032438cf7f163050e782,negative,null,Hi! We are currently conducting a Webinar on COVID-19 vaccines. If you are free. Feel free to join. [https://us02web.zoom.us/j/81139225143?pwd=K2FqdXdIWS9mMHJxR2FSVDViSGhZZz09](https://us02web.zoom.us/j/81139225143?pwd=K2FqdXdIWS9mMHJxR2FSVDViSGhZZz09),1618051517
6072032438cf7f163050e783,negative,null,"Hi yall, my roommate and I share a tiny apartment and there's not much space for us to keep to ourselves in it. She just tested positive but I'm fully vaccinated (Moderna), should I quarantine as well? I couldn't find a clear protocol on this.

The CDC says fully vaccinated folks with exposure and no symptoms don't have to quarantine, but I don't want to put unvaccinated folks in danger.",1618004779
6072032438cf7f163050e784,unknown,null,"So my appointment is on the 25th but a pharmacy just sent a notice I can book now for the Astrazenka vaccine as early as the 14th. Phizer is more effective without any side effects known but we're in the middle of escalating cases here which has started a new lockdown because they are threatening to overwhelm hospitals.  On the other hand I work at home alone and don't need to go anywhere but for groceries (nor is it legal to go anywhere else).  Pfizer and Moderna are 95% effective while AZ is more like 65%. Mind you, that's after two doses and our government has pushed the second dose back for four months... 

I'm inclined to wait the extra 11 days but unsure... Not a ton is known for sure about effectiveness after one dose.",1618021605
