_id,category,isTwitter,text,timeCreated
60859d080dced36d38a0f283,,false,"So, I should preface by explaining that I have severe anxiety that manifests in multiple ways, including physical symptoms and really bad OCD. This was BEFORE covid. Now...it's impossible to describe. My own mind is my worst enemy, the anxiety never stops. Calling it 'coronaphobia' doesn't begin to cover my fear. For the first 3 months I wouldn't leave the INSIDE of my house. And I still won't go into the backyard without a mask.

So right now, I'm worried about starting to go out/be around people again with vaccines rolling out (I'm getting my second Pfizer Ednesday- and already paranoid about both having and not having side effects, but anyway). Like, what if vaccine passports aren't utilized? Will it just never be safe to go to indoor restaurants or movie theaters again? 

And even if they are, what about different vaccines? I know everything they say about how we can't KNOW the vaccines aren't equal, but enough new studies have been done to show the numbers are still pretty significantly different. And literally ALL the focus is on just any vaccine that prevents death. I get that that's the most important factor, I really do. But it seems like nobody even CARES about reducing the chance of actually getting infected anymore. And when even asymptomatic infections can lead to long term health problems, is it safe to be close with someone who got, say, Johnson and Johnson as opposed to Pfizer or Moderna? 

I know all the statistics, I know what the experts say. I know I'm protected to the extent my vaccine allows, but vaccines also rely on other people being vaccinated (and the extent to which they are) in order to provide minimal risk. Even with a vaccine, surveys show most people, like me, don't want to be in close contact with unvaccinated people. But what about vaccinated people with different efficacies, and therefore different chances of getting infected? For example, Johnson and Johnson leaves a significant chance for INFECTION open- is my Pfizer going to be as effective around people who got J and J as it is around people who got Moderna and Pfizer? Will we ever reach herd immunity (or even fully end the pandemic- not the virus, the actual pandemic) with a large part of the population only 66% vaccinated against actual infection (and I've read all the stuff about how you shouldn't compare the vaccines, they were tested at different times, blah blah blah- but Pfizer and Moderna have been tested since and still show stronger efficacy)? 

I already know what the experts say, but as I said before, I don't think the experts are considering all the risks- or, more likely, I think they're deliberately not ADDRESSING all the risks in a well-meaning but misguided attempt to get whatever vaccine in as many arms as soon as possible. 

I'm not even 30 yet, and my anxiety and depression and autism diagnosis mean I haven't even STARTED my life- will I have to live drowning in fear of covid for the rest of it?

(I'm really sorry for the length- I wanted to address everything and I have a tendency to be verbose while writing anyway &gt;.&lt; Also, please know that I don't mean to be rude or imply negative things about anyone based on their choice or availability, nor am I trying to create any kind of vaccine caste system. If anything came out poorly, I'm very sorry- like I said, I have aspergers and even though I try very hard, sometimes my words just come out badly. That's not what I intend at all- I'm just VERY anxious and afraid and wanted to be as honest/thorough as possible.)",1619305155
60859d080dced36d38a0f284,,false,"Hi all, 

I had the second dose of Pfizer yesterday and have been crippled in bed all day due in large part to a headache. I has covid in Dec and had a very strange headache then and again after my first dose. But the headache I have today is different and I wonder if it should be cause for concern. I have taken two ES Tylenol and slept, but the uncomfortable pain in my neck and a tension in my forehead persist. I have been tossing and turning for hours it is so uncomfortable.

Thoughts?",1619291635
60859d080dced36d38a0f285,,false,"This is gonna be a long one so pls be patient.

So, I’ve been going to the doctor/ER pretty often lately for reasons unrelated to COVID. I had to sign a waiver that said they treat COVID   patients in that hospital and it’s a possibility that I might get it. I also removed my mask for one of the tests they were running and in the bathroom. Dumb on my part, I know.

I started having weird body/leg aches, a fever that only lasted for a day, congestion in my nose, and a migraine. This went away and stopped bothering me a couple days ago. 

Last night, I was trying to sleep when I got super nauseous and felt my fever come back. I was super tired so I just went to sleep. When I woke up, my face was SUPER FLUSHED and warm (I am usually very pale in my face), a pounding headache, body aches, fever, chills and overall malaise.

I got tested about an hour ago but I have to wait 3 days for my results. Am I gonna die? I’m really nervous. Any tips for my symptoms while I wait for my results?",1619303578
60859d080dced36d38a0f286,,false,"The seriousness of this matter I'm experiencing with Covid-19 has caused me to create this account and hopefully connect with someone that can share their similar experience with me. 

I started showing Covid-19 symptoms (thought it was a sinus infection) for 4 days, then tested positive on day 5. My symptoms were mild for the most part, much like a mild raspatory infection. However, day 7-8 of showing symptoms I started having shortness of breath. This lasted for only 2-3 days and then started to get better. The issue arising is I'm currently on day 15, and day 12-15 I have been having continuous coming and going of AWFUL headaches. These headaches literally debilitate me to lying in bed until it eventually passes. I've gone to the doctor and my vitals are fine and they said there is nothing directly causing the headaches besides they believe lasting Covid-19 symptom. 

My question is if anyone else has had lingering headaches similar to the timeline of mine? If so, how long did this headaches last and did anything help? I'm hoping my 3rd week from testing positive will hopefully phase these headaches out.",1619286116
60859d080dced36d38a0f287,,false,"Got quarantined by my school on Thursday by my school in their sad excuse of making sure it doesn't spread (school got closed over 10 times for an outbreak). Anyways, the duration of the quarantine goes past my vaccine appointment. Am I unable to get it now? I'm not sick, just quarantined.",1619282574
6085a4b80dced36d38a0f288,,false,"If i test negative but still am showing alot of symptoms, Do i still quarantine? I seen that my test result page said at the bottom of the page to quarantine anyway for 7 days after first symptoms. Can I get an excused note form the health dept for work for this?

The health dept is closed and idk what to do about work tonight.",1619358025
6085a4b80dced36d38a0f289,,false,"Can u travel without having the vaccine, &amp; are you required to take any covid tests etc? Is there a lengthy quarantine? I’m not happy with the state of the nhs rn &amp; would like the option Incase I need to travel to receive faster treatment. Is France health service holding up? Specifically are they performing procedures during lockdowns or is it at a standstill. I’ve seen some New York private dr’s still performing stuff, so I’m kinda confused. Thanks",1619370150
6085a4b80dced36d38a0f28f,,false," \#LIFESTYLE: Here are the BEST paying cities for Moms!  

To read more, download our app today: https://news.bullets.app/hiNd/share 

\#bestpayingcities #cities #bestpayingcitiesformom #formom #northeast #massachusetts #connecticut #florida 

&amp;#x200B;

https://reddit.com/link/my753v/video/0tu7hvj5abv61/player",1619352976
6085a4b80dced36d38a0f291,,false,"Hello, I have had numerous arguments with my father about the death rate and infection rate of covid-19 and how he undersells it. I try to always do my own research on topics via scientific journals and more middle ground media. While I in my head have my thoughts about what things are from what I picked up, I feel my father is just quoting things that lean towards what we feels is right/is true. Today he quoted the following three paragraphs from [this article](https://www.bmj.com/content/371/bmj.m4425/rr-31) which I don't really believe is wholly true and might be cherry picking; pushing the ""covid is just the flu"" narrative:

&gt;Suppression of science and lack of open debate has impinged enormously on three issues of fundamental significance. Firstly, public fear of Covid has been elevated to levels that are completely out of proportion to the actual danger. A recent peer-reviewed paper by one of the world’s most cited and respected scientist, Professor John Ioannidis of Stanford University, quotes an infection fatality rate (IFR) for Covid of 0.00-0.57% (0.05% for under 70s), far lower than originally feared and no different to severe flu [3]. This paper is published on WHO’s own Bulletin but ignored by UK mainstream media.

 

&gt;Secondly, although deaths are currently running at normal levels, fear is being driven by inflation of Covid “cases” caused by inappropriate use of the Polymerase Chain Reaction (PCR) test [4-7]. This test is hypersensitive and highly susceptible to contamination, particularly when not processed with utmost rigour by properly trained staff. Case inflation also occurs from use of excessive number of rounds of amplification cycles (termed CT) which amplifies non-infectious viral fragments and cross-reacting nucleotides from non-Covid coronaviruses/other respiratory viruses. These become mis-labelled as Covid. Even Dr Fauci confirms that a positive result using CT above 34 is invalid (Twitter thread, Jeff Nelson @vegsource 30 October 2020) but in the UK CTs may go up to 45, as confirmed by Professor Carl Heneghan of Oxford University’s Center for Evidence-Based Medicine: (House of Commons Science &amp; Tech Committee, 17 Sep, 2020 YouTube.) An obvious improvement is to immediately halt any use of CTs above 34 and ensure that for CTs between 25 and 34, two consecutive positive results are required before confirming a case as Covid positive.

 

&gt;According to Professor Brookes, a Health Data Scientist from the University of Leicester, the UK’s official data shows no excess deaths due to respiratory infections this season (talkRadio, 'The number of people dying today is the same as it would be any other year', 17 November 2020 YouTube). Instead, excess total deaths have been driven by lack of treatment due to hospital closure/lockdowns and have occurred mostly at home. Whilst there is no question that the first wave of Covid, a then novel virus, was lethal to many, there is no sound evidence of any second wave.

 

&gt;The third and possibly the most consequential suppression of science relates to the narrative that people do not develop immunity following a Covid infection. We know that immunity to SARS-CoV-1 is very durable, persisting for at least 12-17 years [8-10]. Immunologists know that immunity to SARS-Cov-2 is no different. This is confirmed by many eminent scientists including Beda M Stadler, the former Director of the Institute for Immunology at the University of Bern and Professor Emeritus (Ivor Cummins, Ep91 Emeritus Professor of Immunology...Reveals Crucial Viral Immunity Reality, 28 July 2020, YouTube), and Sucharit Bhakdi, former Chair of Medical Microbiology at the University of Mainz [11]. The human population has encountered and co-existed with myriad coronaviruses throughout evolution. Most of us therefore have cross-reacting T-cells, B cells and antibodies derived from encounters with cold coronaviruses that can recognise SARS-CoV-2 [12-14], in the same way that people “immunised” with cowpox became less susceptible to serious illness from smallpox - as Edward Jenner discovered in 1796. This is why we do not generally die from cold coronaviruses and precisely why so many of us were not susceptible to falling severely ill from Covid earlier this year. Even the chance of passing Covid to your spouse at the height of the pandemic was as low as 17%! [15 ].

Is all or any of this publication accurate? If not, whats a good mix of sources that I can look into and let him know about? I want to be as clear on the topic as possible because I am aware of misinformation campaigns that are about right now. Thank for for at least reading through, and hopefully this can serve as a good reference for others in similar situations too!",1619315210
6085a4b80dced36d38a0f293,,false,"So, I should preface by explaining that I have severe anxiety that manifests in multiple ways, including physical symptoms and really bad OCD. This was BEFORE covid. Now...it's impossible to describe. My own mind is my worst enemy, the anxiety never stops. Calling it 'coronaphobia' doesn't begin to cover my fear. For the first 3 months I wouldn't leave the INSIDE of my house. And I still won't go into the backyard without a mask.

So right now, I'm worried about starting to go out/be around people again with vaccines rolling out (I'm getting my second Pfizer Ednesday- and already paranoid about both having and not having side effects, but anyway). Like, what if vaccine passports aren't utilized? Will it just never be safe to go to indoor restaurants or movie theaters again? 

And even if they are, what about different vaccines? I know everything they say about how we can't KNOW the vaccines aren't equal, but enough new studies have been done to show the numbers are still pretty significantly different. And literally ALL the focus is on just any vaccine that prevents death. I get that that's the most important factor, I really do. But it seems like nobody even CARES about reducing the chance of actually getting infected anymore. And when even asymptomatic infections can lead to long term health problems, is it safe to be close with someone who got, say, Johnson and Johnson as opposed to Pfizer or Moderna? 

I know all the statistics, I know what the experts say. I know I'm protected to the extent my vaccine allows, but vaccines also rely on other people being vaccinated (and the extent to which they are) in order to provide minimal risk. Even with a vaccine, surveys show most people, like me, don't want to be in close contact with unvaccinated people. But what about vaccinated people with different efficacies, and therefore different chances of getting infected? For example, Johnson and Johnson leaves a significant chance for INFECTION open- is my Pfizer going to be as effective around people who got J and J as it is around people who got Moderna and Pfizer? Will we ever reach herd immunity (or even fully end the pandemic- not the virus, the actual pandemic) with a large part of the population only 66% vaccinated against actual infection (and I've read all the stuff about how you shouldn't compare the vaccines, they were tested at different times, blah blah blah- but Pfizer and Moderna have been tested since and still show stronger efficacy)? 

I already know what the experts say, but as I said before, I don't think the experts are considering all the risks- or, more likely, I think they're deliberately not ADDRESSING all the risks in a well-meaning but misguided attempt to get whatever vaccine in as many arms as soon as possible. 

I'm not even 30 yet, and my anxiety and depression and autism diagnosis mean I haven't even STARTED my life- will I have to live drowning in fear of covid for the rest of it?

(I'm really sorry for the length- I wanted to address everything and I have a tendency to be verbose while writing anyway &gt;.&lt; Also, please know that I don't mean to be rude or imply negative things about anyone based on their choice or availability, nor am I trying to create any kind of vaccine caste system. If anything came out poorly, I'm very sorry- like I said, I have aspergers and even though I try very hard, sometimes my words just come out badly. That's not what I intend at all- I'm just VERY anxious and afraid and wanted to be as honest/thorough as possible.)",1619305155
6085a4b80dced36d38a0f292,,false,Hey so I am 17 and I got the pfizer shot and I had a pretty bad reaction the night of just getting a fever and chills but then 2 days later I wake up and there’s a huge rash on my face !?!??? Did anything like this happen to someone,1619307264
6085a4b80dced36d38a0f294,,false,"Hi all, 

I had the second dose of Pfizer yesterday and have been crippled in bed all day due in large part to a headache. I has covid in Dec and had a very strange headache then and again after my first dose. But the headache I have today is different and I wonder if it should be cause for concern. I have taken two ES Tylenol and slept, but the uncomfortable pain in my neck and a tension in my forehead persist. I have been tossing and turning for hours it is so uncomfortable.

Thoughts?",1619291635
6085a4b80dced36d38a0f28b,,false,"The first honestly kicked my ass.. a few days of joint pain? ok.. but the nausea .. my T1 diabetic, alcoholic self went into a bad spiral of not being able to eat, causing continued nausea until I had several bad blood glucose drops.. I got it on the 3rd, and am only the last few days really recovered.. not to mention the unpleaseantness of vomiting.. I'm still wearing a mask.. how much more protection will the second round really give me?",1619361415
6085a4b80dced36d38a0f295,,false,"This is gonna be a long one so pls be patient.

So, I’ve been going to the doctor/ER pretty often lately for reasons unrelated to COVID. I had to sign a waiver that said they treat COVID   patients in that hospital and it’s a possibility that I might get it. I also removed my mask for one of the tests they were running and in the bathroom. Dumb on my part, I know.

I started having weird body/leg aches, a fever that only lasted for a day, congestion in my nose, and a migraine. This went away and stopped bothering me a couple days ago. 

Last night, I was trying to sleep when I got super nauseous and felt my fever come back. I was super tired so I just went to sleep. When I woke up, my face was SUPER FLUSHED and warm (I am usually very pale in my face), a pounding headache, body aches, fever, chills and overall malaise.

I got tested about an hour ago but I have to wait 3 days for my results. Am I gonna die? I’m really nervous. Any tips for my symptoms while I wait for my results?",1619303578
6085a4b80dced36d38a0f296,,false,"The seriousness of this matter I'm experiencing with Covid-19 has caused me to create this account and hopefully connect with someone that can share their similar experience with me. 

I started showing Covid-19 symptoms (thought it was a sinus infection) for 4 days, then tested positive on day 5. My symptoms were mild for the most part, much like a mild raspatory infection. However, day 7-8 of showing symptoms I started having shortness of breath. This lasted for only 2-3 days and then started to get better. The issue arising is I'm currently on day 15, and day 12-15 I have been having continuous coming and going of AWFUL headaches. These headaches literally debilitate me to lying in bed until it eventually passes. I've gone to the doctor and my vitals are fine and they said there is nothing directly causing the headaches besides they believe lasting Covid-19 symptom. 

My question is if anyone else has had lingering headaches similar to the timeline of mine? If so, how long did this headaches last and did anything help? I'm hoping my 3rd week from testing positive will hopefully phase these headaches out.",1619286116
6085a4b80dced36d38a0f28a,,false,I work in a deli. I just found out from my coworker that his room mate has covid. I worked with him all day last week. It has been 2 days and they still have notified us. I only found out when I called him. I called my work and asked them If I should still come in and get a test and they told me to hold off and come in as usual. This seems shady. What is the policy for this?,1619369852
6085a4b80dced36d38a0f28e,,false," Hi! I'm doing a survey about mental health and COVID-19's impact on it for my university module. This is an anonymous survey and will strictly only be used to gather general figures and data for my University module. Feel free to answer questions as deeply as you like - you do not have to go into detail about anything you do not wish to.

Thanks for any help! :) Link -[ https://forms.gle/4YuFL7EpKC2FJt2a9](https://forms.gle/4YuFL7EpKC2FJt2a9)",1619353480
6085a4b80dced36d38a0f28d,,false,"Does this sound normal, or even right for the second dose of covid? I’ve got a high fever, headaches, muscle cramps, constipated, both my eyes are bloodshot, and my appetite is decreasing.

I got the shot on Monday, and these started yesterday with probably the worst fever and headache combo I’ve had in a long time. Let alone, the muscle cramps that stopped me from sleeping. Is this a reaction to the vaccine, or might I be positive?",1619306718
6085a4b80dced36d38a0f290,,false," 

Hello, Friends all Nation! I would like to concern you all regarding the devastating corona case in **INDIA**. Every day lakh’s of people are being affected by corona. Thousand’s of people are dying daily in every region of our country. Each day we break our record of patients and death tolls. Doctors, Politicians, the Army, industrialists, Entrepreneurs, Religious institutes, NGO’s and many sections of our societies are trying their best to help each other in these devastating conditions. Due to record cases, hospitals are treating patients in full capacity. Tones of oxygen are used daily for treatment in these hospitals. Lots of medicine are used for the treatment of patients daily. Due to this many of the regions in our country have an acute shortage of oxygen and essential medicine. Our Pharma Industries are trying their best by working at full capacity to deal with this shortage of medicine and oxygen. Some countries are already helping us by providing oxygen tanks, airlifting mobile oxygen plants, providing us doses of vaccines as much as they can. But after all these efforts are being made the conditions are getting worse day by day. People are traumatizing with fear! Families are losing their loved ones, Doctors are losing their will. Fear is arising among all of us. But all we have is hope!

I urge all the people who read this to please provide the people of India, **Hope!**

**Hope to live again, to be with our loved ones again, to be healthy again, to live with freedom again, and to be United AGAIN!**

Your one small wish to concern about this situation for us can ignite the ray of hope again among ourselves to overcome our fear now.

Thank’s for reading this Sir/Madam.",1619281213
6085a4b80dced36d38a0f28c,,false,"It is a long story but i'll start where i can. (typing this out is going to be a bitch.) So the start of 2020. Obviously this was something everyone can relate to. March 3rd. This is before any covid news hit the u.s. I was at work when i got a call from my husband, my dad had fallen down the stairs of my childhood home.

 I knew something was wrong, my dad had never fallen out of nowhere before, he was only 56. I called my dad, and he sounded exhausted, so tired he could barely speak. Luckily, i only worked 3 minutes away EXACTLY..

 I asked him if he needed medical attention and he said he wasnt sure. I quickly hung up with my dad and darted to my truck across the parkinlot. As i am running, i CALL 911 AND tell them to meet me there.

  Now REWIND 24 HOURS, when i left for work that morning, there is a set of rail road tracks that run through our whole neighborhood. This train was sitting behind my house. FOR WEEKS!
    i had called multiple times to move this railcar. Its illegal to park where they did. They have an entire train yard 50 yards away. 

     So the day everything happened, they had finally moved this train, they blocked the neighboring street, tracks THEY NEVER USE! THEY BLOCKED THE ROAD. AFTER I GOT THE CALL ABOUT MY DAD I RUSH DOWN MY USUAL STREET AND ITS BLOCKED BY A TRAIN FOR THE FIRST TIME IN 30 PLUS YEARS. 

     i go around. Im 2 minutes off. I run  up the stairs and unlock the doors. Ems never followed me in. I came back to the door and yelled WHT ARE YOU FUCKING WAITIN FOR!??! 
   I RUN UP THE STAIRS  looking at the blood from my father as i run to the second story, he had dragged himself back up the stairs.. 

    I see him, laying face down on his bed. He isnt moving. He isnt breathing. I shake him. I yell for him to wake up. DAD ! DAAAD! DAD WAKE UP! HE DOESNT MOVE. (I have medical experience) i notice he soiled himself, and then i knew. I was literally 2 minutes too late. 

Honestly TOLEDO ems. Y'ALL NEED SOME WORK! SO.
 My dad, hes gone. Then came his father. I moved from ohio to tn. Cared for my grandfather for a few months til he eventually succumbed to kidney failure without dialisys.

  It's messed up. I still havnt found a way to deal with my loss.

  I not only lost my father and grandfather before covid. I had to Deal with my loss in quarantine. But just before this, i lost both of my grandmothers, my closest uncle, my husbands father....
 and i just cant help but wonder. Was it covid before covid started??? 

  It was already here but we had no warnings. No one had traveled in my family. We lost 8 people im 3 months BEFORE THE GOVERNMENT DID ANYTHING!!! AM I WORNG??? 

Ok editing, to make paragraphs... cuz thats a thing.",1619317722
